{
  "$schema": "https://json-schema.org/draft/2020-12/schema",
  "$id": "https://psyml.dev/schemas/result-1.0.json",
  "title": "PsyML result summary",
  "type": "object",
  "additionalProperties": false,
  "required": ["schema_version", "status", "task", "metrics", "warnings", "artifacts"],
  "properties": {
    "schema_version": {"const": "1.0"},
    "selection_protocol": {"const": "nested_family_v1"},
    "status": {"enum": ["completed", "completed_with_errors"]},
    "task": {"enum": ["classification", "regression"]},
    "metrics": {"type": "object", "additionalProperties": {"type": "number"}},
    "warnings": {"type": "array", "items": {"type": "string"}},
    "fit_warnings": {
      "type": "array",
      "items": {
        "type": "object",
        "required": ["category", "message", "scope", "model", "validation", "fold", "parameters", "count"],
        "additionalProperties": false,
        "properties": {
          "category": {"type": "string"},
          "message": {"type": "string"},
          "scope": {"enum": ["inner", "outer", "final"]},
          "model": {"type": "string"},
          "validation": {"type": "string"},
          "fold": {"type": "integer", "minimum": 0},
          "parameters": {"type": "object"},
          "count": {"type": "integer", "minimum": 1}
        }
      }
    },
    "artifacts": {"type": "object", "additionalProperties": {"type": "string"}},
    "evaluation_scope": {"enum": ["nested_selection_procedure", "prespecified_family", "independent_validations"]},
    "best_model": {"type": "string"},
    "best_validation": {"type": "string"},
    "primary_validation": {"type": ["string", "null"]},
    "validation_results": {
      "type": "object",
      "additionalProperties": {
        "type": "object",
        "required": ["status"],
        "additionalProperties": false,
        "properties": {
          "status": {"enum": ["completed", "failed"]},
          "result_path": {"type": "string"},
          "metrics": {"type": "object", "additionalProperties": {"type": "number"}},
          "error": {"type": "object"}
        }
      }
    },
    "selection_metric": {"type": "string"},
    "model_export": {"type": "object"},
    "effective_parameters": {"type": "object"},
    "best_parameters": {"type": "object"},
    "evaluated_combinations": {"type": "integer", "minimum": 0},
    "permutation": {"type": "object"},
    "interpretation": {"type": "object"},
    "coefficients": {"type": "object"}
  }
}
