{
  "artifacts": {
    "analysis_config": "analysis_config.json",
    "analysis_manifest": "analysis_manifest.json",
    "best_parameters": "best_parameters.json",
    "confusion_matrix": "confusion_matrix.csv",
    "figure": "figures/confusion_matrix.png",
    "fold_metrics": "fold_metrics.csv",
    "methods_summary": "methods_summary.md",
    "metrics": "metrics.csv",
    "metrics_summary": "metrics_summary.csv",
    "model_comparison": "model_comparison.csv",
    "parameter_search": "parameter_search.csv",
    "predictions": "predictions.csv",
    "reproducibility_report": "reproducibility_report.md",
    "result": "result.json",
    "selection_trace": "selection_trace.csv",
    "study_config": "study_config.json",
    "validation_summary": "validation_summary.csv",
    "warnings": "warnings.json"
  },
  "best_model": "decision_tree",
  "best_parameters": {
    "max_depth": 10,
    "min_samples_leaf": 3
  },
  "best_validation": "group_k_fold",
  "evaluated_combinations": 2,
  "evaluation_scope": "nested_selection_procedure",
  "metrics": {
    "accuracy": 1.0,
    "balanced_accuracy": 1.0,
    "f1_macro": 1.0,
    "f1_weighted": 1.0,
    "precision_macro": 1.0,
    "precision_weighted": 1.0,
    "recall_macro": 1.0,
    "recall_weighted": 1.0,
    "roc_auc": 1.0
  },
  "schema_version": "1.0",
  "selection_metric": "balanced_accuracy",
  "selection_protocol": "nested_family_v1",
  "status": "completed",
  "task": "classification",
  "warnings": [
    "Primary metrics evaluate the nested model-family and parameter selection procedure, not the final full-data model. Family leaderboard ranks are exploratory; choosing from their outer scores introduces selection bias. External validity requires appropriate independent data."
  ]
}
