{
  "artifacts": {
    "analysis_config": "analysis_config.json",
    "analysis_manifest": "analysis_manifest.json",
    "best_parameters": "best_parameters.json",
    "figure": "figures/observed_vs_predicted.png",
    "fold_metrics": "fold_metrics.csv",
    "methods_summary": "methods_summary.md",
    "metrics": "metrics.csv",
    "metrics_summary": "metrics_summary.csv",
    "model_comparison": "model_comparison.csv",
    "parameter_search": "parameter_search.csv",
    "predictions": "predictions.csv",
    "reproducibility_report": "reproducibility_report.md",
    "result": "result.json",
    "selection_trace": "selection_trace.csv",
    "study_config": "study_config.json",
    "validation_summary": "validation_summary.csv",
    "warnings": "warnings.json"
  },
  "best_model": "dummy",
  "best_parameters": {},
  "best_validation": "group_k_fold",
  "evaluated_combinations": 1,
  "evaluation_scope": "prespecified_family",
  "metrics": {
    "mae": 1.959312737455197,
    "r2": -0.37398226107857285,
    "rmse": 2.386294355581652
  },
  "schema_version": "1.0",
  "selection_metric": "rmse",
  "selection_protocol": "nested_family_v1",
  "status": "completed",
  "task": "regression",
  "warnings": [
    "Dropped 1 rows because missing_strategy='drop'.",
    "Dropped 1 rows with missing target values."
  ]
}
