{
  "artifacts": {
    "analysis_config": "analysis_config.json",
    "analysis_manifest": "analysis_manifest.json",
    "best_parameters": "best_parameters.json",
    "confusion_matrix": "confusion_matrix.csv",
    "figure": "figures/confusion_matrix.png",
    "fold_metrics": "fold_metrics.csv",
    "methods_summary": "methods_summary.md",
    "metrics": "metrics.csv",
    "metrics_summary": "metrics_summary.csv",
    "model_comparison": "model_comparison.csv",
    "parameter_search": "parameter_search.csv",
    "predictions": "predictions.csv",
    "reproducibility_report": "reproducibility_report.md",
    "result": "result.json",
    "selection_trace": "selection_trace.csv",
    "study_config": "study_config.json",
    "validation_summary": "validation_summary.csv",
    "warnings": "warnings.json"
  },
  "best_model": "decision_tree",
  "best_parameters": {},
  "best_validation": "holdout",
  "evaluated_combinations": 66,
  "evaluation_scope": "nested_selection_procedure",
  "metrics": {
    "accuracy": 1.0,
    "balanced_accuracy": 1.0,
    "f1_macro": 1.0,
    "f1_weighted": 1.0,
    "precision_macro": 1.0,
    "precision_weighted": 1.0,
    "recall_macro": 1.0,
    "recall_weighted": 1.0,
    "roc_auc": 1.0
  },
  "schema_version": "1.0",
  "selection_metric": "balanced_accuracy",
  "selection_protocol": "nested_family_v1",
  "status": "completed",
  "task": "classification",
  "warnings": [
    "A group column was supplied but at least one selected validation strategy does not isolate groups.",
    "Primary metrics evaluate the nested model-family and parameter selection procedure, not the final full-data model. Family leaderboard ranks are exploratory; choosing from their outer scores introduces selection bias. External validity requires appropriate independent data.",
    "Failed combination holdout/qda: ValueError: All parameter candidates failed for qda in holdout outer fold 1",
    "Failed combination k_fold/qda: ValueError: All parameter candidates failed for qda in k_fold outer fold 1 | ValueError: All parameter candidates failed for qda in k_fold outer fold 2 | ValueError: All parameter candidates failed for qda in k_fold outer fold 3",
    "Failed combination stratified_k_fold/qda: ValueError: All parameter candidates failed for qda in stratified_k_fold outer fold 1 | ValueError: All parameter candidates failed for qda in stratified_k_fold outer fold 2 | ValueError: All parameter candidates failed for qda in stratified_k_fold outer fold 3",
    "Failed combination group_k_fold/qda: ValueError: All parameter candidates failed for qda in group_k_fold outer fold 1 | ValueError: All parameter candidates failed for qda in group_k_fold outer fold 2 | ValueError: All parameter candidates failed for qda in group_k_fold outer fold 3",
    "Failed combination stratified_group_k_fold/qda: ValueError: All parameter candidates failed for qda in stratified_group_k_fold outer fold 1 | ValueError: All parameter candidates failed for qda in stratified_group_k_fold outer fold 2 | ValueError: All parameter candidates failed for qda in stratified_group_k_fold outer fold 3",
    "Failed combination leave_one_group_out/qda: ValueError: All parameter candidates failed for qda in leave_one_group_out outer fold 1 | ValueError: All parameter candidates failed for qda in leave_one_group_out outer fold 2 | ValueError: All parameter candidates failed for qda in leave_one_group_out outer fold 3 | ValueError: All parameter candidates failed for qda in leave_one_group_out outer fold 4 | ValueError: All parameter candidates failed for qda in leave_one_group_out outer fold 5 | ValueError: All parameter candidates failed for qda in leave_one_group_out outer fold 6 | ValueError: All parameter candidates failed for qda in leave_one_group_out outer fold 7 | ValueError: All parameter candidates failed for qda in leave_one_group_out outer fold 8 | ValueError: All parameter candidates failed for qda in leave_one_group_out outer fold 9 | ValueError: All parameter candidates failed for qda in leave_one_group_out outer fold 10 | ValueError: All parameter candidates failed for qda in leave_one_group_out outer fold 11 | ValueError: All parameter candidates failed for qda in leave_one_group_out outer fold 12",
    "Final inner selection failed for qda: All parameter candidates failed for qda in holdout outer fold 0"
  ]
}
